id,userinput,output
1,What are some effective exercises for building core strength?,"Building core strength is crucial! Try incorporating planks, Russian twists, and leg raises into your routine. These exercises target different core muscles for a well-rounded workout."
2,Can you suggest a quick home workout for days when I'm short on time?,"Of course! A quick home workout could include bodyweight squats, push-ups, lunges, and burpees. Perform each exercise for 30 seconds with minimal rest between. It's a great way to squeeze in a workout!"
3,I want to improve my flexibility. Any stretching routines you recommend?,"Improving flexibility is fantastic for overall fitness. Include stretches like toe touches, hip flexor stretches, and yoga poses like downward dog. Hold each stretch for 15-30 seconds and focus on deep, controlled breaths."
4,What's a good post-workout meal for muscle recovery?,"After a workout, prioritize a meal rich in protein and carbohydrates. Consider options like grilled chicken with sweet potatoes or a protein smoothie with fruits and Greek yogurt. Hydration is key too!"
5,How often should I change my workout routine for better results?,"Changing your workout routine every 4-6 weeks can prevent plateaus and keep your body challenged. Consider adjusting exercises, intensity, or trying new activities to keep things fresh."
6,I'm a beginner. What's a good starting point for strength training?,"Welcome to strength training! Begin with bodyweight exercises like squats, push-ups, and lunges. Gradually add weights as you get more comfortable. Focus on proper form to avoid injuries."
7,What's the best way to stay motivated for regular workouts?,"Staying motivated is key! Set specific, achievable goals, find a workout buddy, and mix up your routine. Reward yourself for milestones, and remember that consistency is more important than intensity."
8,Can you recommend exercises to relieve lower back pain?,"To relieve lower back pain, try exercises like cat-cow stretches, pelvic tilts, and knee-to-chest stretches. Consult with a healthcare professional if the pain persists."
9,What are the benefits of including high-intensity interval training (HIIT) in my workouts?,"HIIT offers benefits like increased calorie burn, improved cardiovascular health, and efficient time use. It involves short bursts of intense exercise followed by brief rest periods. Consider adding it to your routine for variety."
10,How important is rest in a fitness routine?,"Rest is crucial for recovery and preventing burnout. Allow at least one or two rest days per week. Listen to your body, prioritize sleep, and let your muscles recover for better overall fitness."
11,I have a busy schedule. How can I maintain a healthy lifestyle despite time constraints?,"Balancing a busy schedule is challenging but possible! Prioritize short, effective workouts, plan healthy meals in advance, and practice stress management techniques like deep breathing. Consistency is key!"
12,What foods should I include in my diet to boost overall health?,"For overall health, include a variety of fruits, vegetables, whole grains, and lean proteins in your diet. These provide essential nutrients and support various aspects of your health."
13,How can I manage stress for better mental and physical health?,"Managing stress is crucial for overall well-being. Try activities like meditation, yoga, or deep breathing exercises. Exercise, adequate sleep, and maintaining a social support network also contribute to stress management."
14,Can you suggest preventive healthcare measures for maintaining good health?,"Preventive healthcare is essential! Schedule regular check-ups, stay up-to-date on vaccinations, maintain a healthy lifestyle, and be proactive in addressing any health concerns. Early detection is key."
15,"I've heard about telehealth. How does it work, and is it effective?","Telehealth allows you to consult with healthcare professionals remotely. It's effective for non-emergency situations, providing convenience and accessibility. Consult with your healthcare provider to see if it's a suitable option for your needs."
16,What are some at-home remedies for common cold and flu symptoms?,"For cold and flu symptoms, consider staying hydrated, getting plenty of rest, and using remedies like warm tea with honey and ginger. If symptoms persist or worsen, consult with a healthcare professional."
17,How can I improve my sleep quality for better health?,"Improving sleep quality is vital. Create a consistent sleep schedule, establish a relaxing bedtime routine, and ensure your sleep environment is comfortable and dark. Limit screen time before bedtime for better sleep."
18,Is it necessary to take supplements for a balanced diet?,"While it's best to obtain nutrients from food, supplements can be beneficial for specific needs. Consult with a healthcare professional to determine if you need supplements and the appropriate dosage."
19,I'm recovering from an injury. What exercises can I do without exacerbating it?,Recovering from an injury requires caution. Focus on low-impact exercises like swimming or stationary cycling. Consult with a healthcare provider or physiotherapist for a personalized recovery plan.
20,Can you recommend mental health resources for coping with stress and anxiety?,"Absolutely! Resources like meditation apps, online therapy platforms, and community support groups can be helpful. Prioritize self-care and seek professional help if needed for mental health concerns."
21,I want to quit smoking. Can you provide tips for a successful quit journey?,"Quitting smoking is a commendable goal! Consider creating a quit plan, seeking support from friends or a support group, and using resources like helplines or apps. Your healthcare provider can also offer guidance."
22,How can I incorporate mindfulness into my daily routine for better mental health?,"Mindfulness practices like meditation and mindful breathing can benefit mental health. Start with short sessions daily, and gradually increase. Consistency is key to experiencing the positive effects."
23,What are the benefits of regular cardiovascular exercise for heart health?,"Cardiovascular exercise, like brisk walking or jogging, improves heart health by increasing circulation, reducing blood pressure, and lowering cholesterol levels. Aim for at least 150 minutes per week for optimal benefits."
24,I have trouble sticking to a healthy diet. Any practical tips for better nutrition?,"Maintaining a healthy diet can be challenging. Plan meals ahead, keep healthy snacks on hand, and practice mindful eating. Gradual changes are more sustainable than drastic ones."
25,How can I stay active during a busy workday?,"Staying active at work is crucial. Take short breaks for stretching, use stairs when possible, and consider desk exercises. Even brief movement throughout the day can contribute to overall fitness."
26,Can you recommend home remedies for relieving muscle soreness after a workout?,"Muscle soreness is common after a workout. Try remedies like a warm bath, gentle stretching, or applying a cold compress. Staying hydrated and getting adequate rest also help in recovery."
27,I'm considering a plant-based diet. How can I ensure I get enough protein and nutrients?,"A plant-based diet can be nutritious. Include sources of plant-based protein like beans, lentils, and tofu. Supplement with B12, iron, and omega-3 fatty acids if needed. Consult a healthcare professional for personalized advice."
28,"What are the warning signs of dehydration, and how can I stay hydrated?","Common signs of dehydration include dark urine and feeling thirsty. Drink water throughout the day, especially during exercise. Foods like fruits and vegetables also contribute to hydration."
29,I'm interested in starting a mindfulness practice. Any beginner-friendly tips?,"Great choice! Start with short mindfulness sessions, focusing on your breath or a guided meditation. Use mindfulness apps for guidance. Consistency is more important than duration in the beginning."
30,"How does stress impact physical health, and what can I do to manage it?","Stress can impact physical health by affecting the immune system and contributing to various health issues. Manage stress through activities like exercise, meditation, and seeking support from friends or professionals."
31,I often feel fatigued. What lifestyle changes can I make to boost my energy levels?,"Fatigue can result from various factors. Ensure you're getting enough quality sleep, stay hydrated, and maintain a balanced diet. Regular exercise, even a brisk walk, can also increase energy levels."
32,"Is there a recommended frequency for health check-ups, and what should they include?","Health check-ups are essential for preventive care. Schedule an annual check-up that includes screenings for blood pressure, cholesterol, and other age-appropriate tests. Discuss any concerns with your healthcare provider."
33,I have arthritis. Can you recommend exercises that won't aggravate my condition?,Exercising with arthritis requires caution. Consider low-impact activities like swimming or gentle yoga. Consult with your healthcare provider or a physiotherapist for personalized recommendations.
34,How can I maintain a healthy diet while traveling?,"Maintaining a healthy diet while traveling can be challenging. Pack nutritious snacks, choose balanced meals when possible, and stay hydrated. Planning ahead can help you make healthier choices on the go."
35,I'm curious about intermittent fasting. What are its potential health benefits?,"Intermittent fasting has potential benefits, including weight management and improved metabolic health. It involves cycles of eating and fasting. Consult with a healthcare professional to determine if it's suitable for you."
36,Can you recommend exercises for improving posture?,"Improving posture is important for overall health. Incorporate exercises like shoulder blade squeezes, chin tucks, and core-strengthening exercises. Focus on maintaining good posture throughout the day."
37,What role does hydration play in skin health?,"Hydration is crucial for skin health. It helps maintain skin elasticity, reduce dryness, and promote a healthy complexion. Drink an adequate amount of water, and include hydrating foods in your diet."
38,I'm trying to lose weight. Any tips for creating a sustainable weight loss plan,"Creating a sustainable weight loss plan involves balanced nutrition and regular exercise. Set realistic goals, prioritize whole foods, and find enjoyable physical activities. Consult with a healthcare professional for personalized guidance."
39,How can I incorporate mindfulness into my fitness routine?,"Mindfulness in fitness enhances the mind-body connection. Practice mindful breathing during workouts, focus on the sensations of movement, and consider activities like yoga or tai chi for a mindful approach to exercise."
40,What are the benefits of maintaining a strong social support network for health?,"A strong social support network contributes to better mental and physical health. It provides emotional support, reduces stress, and encourages healthy behaviors. Cultivate positive relationships for overall well-being."
41,How can I create a workout routine that targets multiple muscle groups?,"Creating a full-body workout routine involves a mix of exercises. Include compound movements like squats and deadlifts, along with isolation exercises for specific muscle groups. Aim for balance and variety in your routine."
42,Can you suggest a dynamic warm-up routine before my workouts?,"Absolutely! A dynamic warm-up is crucial for injury prevention. Include exercises like leg swings, arm circles, and bodyweight lunges. Gradually increase the intensity to prepare your body for the workout."
43,I have a sedentary job. What desk exercises can I do to stay active during work hours?,"Staying active at a desk job is important. Try seated leg lifts, desk push-ups, and neck stretches. Take short breaks to stand and move around. These exercises can help reduce stiffness."
44,"How does strength training contribute to overall fitness, and how often should I include it in my routine?","Strength training enhances muscle strength, bone density, and metabolism. Include it in your routine at least 2-3 times per week, focusing on different muscle groups each session. Consult with a fitness professional for personalized advice."
45,I'm pregnant. Can you recommend safe exercises for each trimester?,"Congratulations! During the first trimester, focus on gentle exercises like walking. In the second trimester, consider prenatal yoga and swimming. In the third trimester, opt for low-impact activities like stationary cycling and modified strength training. Always consult with your healthcare provider."
46,How can I modify exercises for home workouts without equipment?,"Modifying exercises for home workouts is easy! For example, replace weights with household items, like using water bottles as dumbbells. Bodyweight exercises like squats, push-ups, and lunges are effective too."
47,Can you create a sample week-long workout routine for a beginner?,"Certainly! Here's a sample routine: Monday - Full-body workout, Wednesday - Cardio (e.g., brisk walk), Friday - Strength training (focus on upper body), Sunday - Rest or light activity. Adjust intensity based on your comfort and progress."
48,What's the role of flexibility exercises in a well-rounded fitness routine?,"Flexibility exercises improve range of motion, reduce muscle tension, and enhance overall mobility. Include stretches for major muscle groups in your routine. Yoga or Pilates classes are excellent options for flexibility."
49,How can I incorporate high-intensity interval training (HIIT) into my routine?,"HIIT is great for calorie burn and cardiovascular health. Start with short intervals of high-intensity exercise followed by rest. Example: 30 seconds of jumping jacks, 30 seconds rest. Gradually increase intensity and duration as you progress."
50,Can you recommend exercises for improving balance and stability?,"Certainly! Include exercises like single-leg stands, heel-to-toe walks, and stability ball exercises. Enhancing balance and stability is crucial for overall fitness and injury prevention."
51,I have a busy schedule. How can I squeeze in short workouts throughout the day?,"Short, intense workouts are great for a busy schedule! Try 10-minute high-intensity intervals or break longer workouts into shorter sessions. Even a quick workout can make a significant impact."
52,"What's the importance of cooldown exercises, and can you suggest some?","Cooldown exercises help your heart rate and breathing return to normal and prevent muscle stiffness. Include stretches like hamstring stretches, shoulder stretches, and deep breathing in your cooldown routine."
53,I've heard about the 7-minute workout. Is it effective for fitness?,"Yes, the 7-minute workout is a quick and effective option for boosting fitness. It includes high-intensity exercises like jumping jacks and push-ups. It's a great choice for those with time constraints."
54,How can I stay motivated to stick to my workout routine long-term?,"Staying motivated is key! Set realistic goals, find activities you enjoy, and switch up your routine to keep it interesting. Consider tracking your progress and celebrating milestones along the way."
55,I have a specific fitness goal. Can you help me create a personalized workout plan?,"Absolutely! To create a personalized workout plan, I'll need details about your goal, current fitness level, any health considerations, and the equipment you have. Let's work together to design a plan tailored to you."
56,What role does proper nutrition play in maximizing workout results?,"Nutrition is crucial for optimal workout results. Fuel your body with a balance of carbohydrates, proteins, and healthy fats. Stay hydrated and consider pre- and post-workout snacks for energy and recovery."
57,How can I prevent injuries during workouts?,"Preventing injuries is vital. Always warm up before exercise, use proper form, gradually increase intensity, and listen to your body. Include strength training to improve joint stability and flexibility exercises for suppleness."
58,I'm new to weightlifting. Can you recommend a beginner-friendly routine?,"Certainly! Start with compound exercises like squats and deadlifts. Begin with lighter weights, focusing on proper form. Gradually increase the weight as you become more comfortable. Consistency is key."
59,What's the significance of rest days in a workout routine?,"Rest days are crucial for recovery. They allow muscles to repair and prevent burnout. Incorporate at least one or two rest days per week into your routine. Active recovery, like light walking, can also be beneficial."
60,How can I make my home workouts more enjoyable and less monotonous?,"Making home workouts enjoyable is key for consistency. Create a diverse routine, play music, try new exercises, or follow online workout videos. Finding activities you love makes the process more engaging and fun."
61,Is it better to do cardio before or after strength training?,"The order depends on your goals. For general fitness, either order works. If your focus is on strength, do it first. If you prioritize endurance, start with cardio. Experiment and see what feels most effective for you."
62,I have a home gym. Can you suggest space-efficient equipment for a variety of exercises?,"Certainly! Consider resistance bands, kettlebells, and a stability ball. They're versatile, space-efficient, and allow for a wide range of exercises. Dumbbells and a yoga mat can also enhance your home gym setup."
63,"What's the significance of proper hydration during workouts, and how much water should I drink?","Proper hydration is crucial for performance and recovery. Drink water before, during, and after workouts. A general guideline is to aim for 8 ounces every 15 minutes during exercise. Adjust based on intensity and personal needs."
64,How can I stay active during the winter months when it's cold outside?,"Winter can pose challenges, but you can stay active indoors. Try home workouts, dance to music, or consider winter sports like indoor rock climbing. Layer up for outdoor activities if weather permits."
65,I've hit a plateau in my fitness journey. Any tips for overcoming it?,"Plateaus are common. Mix up your routine, try new exercises, and increase intensity. Set new goals, consider a fitness class, or consult with a fitness professional for personalized guidance."
66,What are the benefits of including mindfulness in a fitness routine?,"Mindfulness enhances the mind-body connection, improves focus, and reduces stress. Incorporate mindfulness techniques like deep breathing into your warm-up or cooldown. It can enhance overall well-being."
67,I have a busy lifestyle. Can you suggest quick and effective at-home workouts?,"Absolutely! Quick workouts can be effective. Try high-intensity interval training (HIIT) sessions, bodyweight exercises, or Tabata workouts. They require minimal time and still deliver great results."
68,I'm recovering from an illness. How can I ease back into a workout routine safely?,"Welcome back! Start slow with low-intensity activities like walking or gentle yoga. Listen to your body, gradually increase intensity, and consult with your healthcare provider for personalized advice on your recovery journey."
69,"What's the role of protein in muscle recovery, and can you suggest post-workout snacks?","Protein is crucial for muscle recovery. Optimal post-workout snacks include a protein shake, Greek yogurt with fruit, or a turkey and vegetable wrap. These provide the necessary nutrients for recovery."
70,"How can I track my fitness progress, and what metrics should I focus on?","Tracking progress is motivating. Monitor metrics like strength gains, endurance improvement, and changes in body composition. Consider keeping a workout journal or using fitness apps to record your achievements."
71,I have a desk job. Can you recommend exercises to counteract the effects of sitting for long hours?,"Combat the effects of prolonged sitting with exercises like seated leg lifts, desk stretches, and standing breaks. Incorporate these throughout the day to improve posture and reduce stiffness."
72,How can I avoid overtraining and listen to my body's signals during workouts?,"Avoid overtraining by scheduling rest days, varying your workouts, and paying attention to fatigue, soreness, or persistent pain. Listen to your body; it will signal when it needs rest or a lighter workout."
73,"What's the role of a warm-up in injury prevention, and how long should it be?","A proper warm-up increases blood flow and flexibility, reducing the risk of injury. Aim for 5-10 minutes, including dynamic stretches and light cardio. Gradually increase intensity to prepare your body for the workout ahead."
74,I want to start running. Any advice for beginners to prevent injuries?,"Begin with a gradual running program, including walking intervals. Invest in good shoes, focus on proper form, and incorporate strength training to support your muscles and joints. Listen to your body and progress at a comfortable pace."
75,How can I make strength training more enjoyable and less monotonous?,"Add variety to your strength training routine with different exercises, try new equipment, or join a fitness class. Set goals, celebrate achievements, and make it a social activity by exercising with a friend."
76,I've heard about the importance of postural alignment. Can you recommend exercises to improve it?,"Improving postural alignment involves exercises like shoulder blade retractions, wall angels, and core-strengthening exercises. Focus on maintaining good posture during daily activities as well."
77,I travel frequently. How can I stay fit while on the road without access to a gym?,"Staying fit while traveling is possible. Pack resistance bands, use bodyweight exercises, go for a run, or explore local fitness classes. Many workout apps offer travel-friendly routines that require minimal equipment."
78,"What's the role of core strength in overall fitness, and how can I strengthen my core?","Core strength is vital for stability and preventing injuries. Strengthen your core with exercises like planks, Russian twists, and leg raises. Incorporate these into your routine for a well-rounded fitness program."
79,I have a specific dietary restriction. How can I ensure I get the nutrients I need for my workouts?,"Managing dietary restrictions requires careful planning. Focus on alternative sources of nutrients, consider supplements if necessary, and consult with a nutritionist or healthcare professional for personalized guidance."
80,I want to improve my flexibility. Can you suggest a routine for beginners?,"Improving flexibility involves regular stretching. Start with gentle stretches for major muscle groups, holding each stretch for 15-30 seconds. Gradually increase the duration and intensity of your stretches over time."